2021-03-06,Mr. Brooks has resigned from a paid post at the Aspen Institute a think tank and will be involved as a volunteer with a group he founded at Aspen the paper said.,The hackers started their attack in January but escalated their efforts in recent weeks security experts say. Business and government agencies were affected.,The stimulus payments will be $1400 for most recipients. Those who are eligible will also receive an identical payment for each of their children.,There is a big one for people who already have debt.,Payments started to arrive in bank accounts on Wednesday March 17. Some banks made the cash available earlier.,A professor and a comedian walk into Stanford’s business school … and explain why humor in the workplace can be good for both morale and the bottom line.,The pandemic has disrupted international trade driving up the cost of shipping goods and adding a fresh challenge to the global economic recovery.,Disney had hoped to reopen its California attractions in July but faced pushback from unions.,0,0
2021-03-07,Her new husband Dan Jewett is a high school science teacher. He has pledged to work with her in giving away much of her billions.,Studios pushing toward a streaming future remain locked in a battle with theater owners eager for moviegoers to return in droves.,Democrats pushed through a big aid measure for multiemployer pensions whose problems predate the pandemic.,Two top editors at the channel’s new prime-time newscast resigned amid staff complaints of a right-wing tilt and concern over the involvement of the former Fox News chief Bill Shine.,A saucy campaign from a fashion brand stakes out “the new normal” a world without face masks and social distancing while other companies are working on cheerful marketing messages.,Consumers’ pandemic reliance on online ordering benefited the giants. For many independent retailers it helped keep the doors open.,0,0,0,0
2021-03-08,It wasn’t all a mess. Here’s how the government and tech companies tamed foreign interference.,A two-hour special revived a faded TV genre the “big-get” prime-time interview that once drew tens of millions for exclusive sit-downs with people like Michael Jackson and Monica Lewinsky.,Inspired by pandemic lessons that kept customers in cars chains are adding more lanes and curbside pickup improving apps and testing menu boards that use artificial intelligence.,The SPAC mogul defended a big stock sale.,Climate concerns push BP and other firms to seek new roles as pollution fighters.,Not by buying airplanes. Instead the newest start-up millionaires are proceeding cautiously.,A downtown New York crowd is pushing back against the homogenization of big social media.,0,0,0
2021-03-09,The three participants’ ties to Netflix and Apple along with Ms. Winfrey’s desire to reach a big live-viewing audience paved the way to an old-school deal with CBS.,As part of the cutbacks BuzzFeed closed HuffPost Canada and announced plans to decrease the size of its operations in Australia and Britain.,Bob Chapek the chief executive of the Walt Disney Company announced the time frame on Tuesday but did not give a specific date.,Lenders are struggling with a new Paycheck Protection Program rule intended to get more money to sole proprietors — and some banks are simply refusing to make the change.,Is the mania for subscriptions a choice or the only path in an ad system dominated by giants?,Offensive posts that Alexi McCammond made in 2011 when she was a teenager were recirculated over the weekend on social media.,The company’s ties to more than a dozen sites illustrate how conservative media companies are branching out after Facebook and Twitter began stiffer policing of false information.,The aircraft maker said it had received 82 new airplane orders in February about half of them for the 737 Max.,Mr. James has joined an expanding national movement that mixes community needs into the formula for socially responsible projects.,Recent commercial real estate transactions in New York.
2021-03-10,The chain’s vendors most of them small-business owners say they are worried they won’t be paid for orders delivered in the weeks just before the filing.,In a rare case Andrea Sahouri a Des Moines Register reporter was prosecuted after covering a protest against racism and police violence in May.,The gaming site valued at $4 billion a year ago has benefited from the way children are passing their time in the pandemic.,To counter online misinformation it helps to knock on doors.,Measuring design and shopping tools built into smartphone apps can help you get your next house in order.,Prices have yet to show much movement but the prospect of an unbridled economy’s surging back from the pandemic has unsettled the markets.,Lina Khan would bring another progressive voice to competition oversight.,The false information arrives on social media and fringe news sites influencing people already facing other hurdles to getting vaccinated. Some activists are going door to door to counter it.,Beijing’s leaders plot a path to go it alone vowing to spend big to fill gaps in innovation and avoid dependence on the United States and others.,When a mayor volunteered his town for a study on nuclear waste his house was firebombed reflecting the lingering anxiety 10 years after the Fukushima disaster.
2021-03-11,The new economic stimulus package makes a tiny change that military veterans pushed for in hopes of stemming aggressive recruiting tactics.,Aviation workers will be protected from furloughs through September under the bill President Biden signed Thursday but a full travel recovery could take years.,A deed for the sale has yet to be recorded but one of the estate’s lawyers said that funds from the sale were being transferred to a compensation program for Mr. Epstein’s victims.,Tech leaders can run wildly successful companies. That doesn’t mean they have a crystal ball.,The Tesla boss and digital prankster is striking a chord at a time of disillusionment with the tech industry and its leading tycoons.,The Biden administration will not enforce two Trump-era rules involving retirement plans including one that effectively discouraged administrators for those plans from choosing investments based on environmental social and governance considerations the Labor Department said on Wednesday.,The action is a sign that the bank is worried less about inflation than about the economic distress caused by the pandemic.,The data tell the scale of upheaval.,Although millions remain jobless and layoffs continue the latest data adds to evidence that distress is on the decline.,For two decades Ian Callum led the look at Jaguar Land Rover. Now he’s reimagining some vintage cars including the Jag Mark 2 and a classic Corvette.
2021-03-12,The payments of up to $1400 per individual are based on tax information filed with the Internal Revenue Service for 2019 or 2020.,Female garment industry union leaders are emerging at the forefront of the deadly anti-military protests and asking global brands to take their side.,The pandemic has showed how much we need technology and its limits.,The Fed the markets and growing inequality.,You might not have filed this year’s return yet but you should keep in mind that Congress changed the rules on things like charitable contributions and tax breaks for educational expenses for 2022.,Health departments continue to grapple with delays caused by technical problems with numerous websites used for making appointments.,When the billionaire Robert Smith settled one of the biggest tax fraud cases ever Vista Equity Partners had already braced them. Solid returns helped too.,Zhang Wenhong has drawn a huge public following with a human touch and candid advice that sometimes runs counter to the government’s authoritarian instincts.,0,0
2021-03-13,A former bank employee contends that the Swiss bank continued to help American clients avoid taxes long after its 2014 plea deal with the U.S. government,Joshua Kushner is steering his venture capital firm out from under the shadow of his older brother — and the Trump administration.,Nursing homes have manipulated the influential star system in ways that have masked deep problems — and left them unprepared for Covid-19.,Each market frenzy seems crazier than the last. But all have the same roots.,0,0,0,0,0,0
2021-03-14,The company has benefited in the pandemic as people turn to online shopping. It is now the most valuable start-up in the United States.,A Maryland hotel magnate who had a deal to buy The Baltimore Sun is now weighing a bid for all of Tribune’s newspapers that could thwart a hedge fund’s plan.,British TV executives see opportunity — and money to be made — in bringing American cable-style clashes to their screens.,Julian Reichelt editor of the tabloid-style Bild denied accusations by female employees but stepped aside while the newspaper’s owner conducts an internal investigation.,Biden’s economic relief package has arrived.,“There is a why-are-we-even-doing-this feeling” one industry insider said of jockeying for nominations to be announced on Monday.,The sandwich chain’s aggressive use of product placement has made it a ubiquitous presence on the country’s television shows.,Amazon Live is a prominent example of how interactive video shopping popularized by TV networks like QVC has moved online.,0,0
2021-03-15,Viewership fell 53 percent drop compared with last year’s show to 8.8 million viewers.,It wouldn’t have been a Carl Hiaasen column if it didn’t go on the attack. In his Miami Herald farewell on Friday Mr. Hiaasen took aim at the sorry state of local news coverage.,The German carmaker outlined ambitious goals to build battery factories as it ties its fate to electric cars.,As millions of people began working exercising and doing just about everything from home during the pandemic sales of sweatpants and dumbbells surged enough to worry the fashion industry about a shortage of leisure wear. Britain’s statisticians expect those consumer trends to stick around.,The lawsuit filed by the state attorney general and other prosecutors accuses Brookdale Senior Living of gaming Medicare’s ubiquitous star-rating system.,Artificial intelligence technology is promising but it’s not a magic potion. Oh well.,Though the recession has been painful policymakers cushioned the pandemic’s blow and opened the way to recovery.,In the year since the pandemic upended the economy more than four million people have quit the labor force. They are not counted in the most commonly cited unemployment rate which stood at 6.2 percent in February making the group something of a hidden casualty of the pandemic.,The data provides the first glimpse into virus cases at Tesla whose chief executive Elon Musk had played down the severity of the pandemic,Matt Granite who goes by The Deal Guy streams daily on Amazon Live covering everything from kitchen gadgets to snowblowers. Under each video is a carousel display of the products he’s discussing. When a viewer clicks that item and buys it Mr. Granite gets a cut with commissions varying from 10 percent for luxury and beauty products to 1 percent for Amazon Fresh items. Mr. Granite’s YouTube channel still brings in more revenue through ad rolls and sponsorships but he said the revenue and audience numbers for his Amazon Live videos have grown over the past year.
2021-03-16,Once again we have socialized an industry’s losses and privatized its profits.,The new legal classification which follows a U.K. court ruling last month will entitle the workers to more pay and benefits but stops short of making them employees.,The government started to send payments Wednesday. More payments will be made in coming weeks including for people who will receive theirs by mail as a check or debit card.,The 18-year-old is expected to serve three years in a juvenile facility in return for the plea.,Google said that starting July 1 it would take 15 percent of the first $1 million developers take in from certain app sales down from 30 percent.,JPMorgan Chase is currently planning for summer interns in New York and London to come to the office people briefed on the matter said on Tuesday as big financial firms anticipate a return to something approaching normality and the pandemic starts to loosen its hold on the workplace.,In France and across Europe more students are facing food insecurity as the pandemic enters its second year and job cuts in their families take a widening toll.,Even the big tech companies don’t have it all figured out.,Inter Milan’s Chinese owners spent heavily on big stars and now it is winning again. But the bill is coming due putting the team’s future in doubt.,CtW an adviser to union pensions sent a sharply worded letter to Artisan Partners the firm that led the revolt over Emmanuel Faber’s leadership.
2021-03-17,The unionization effort which began last summer is the largest and most viable organizing campaign among Amazon workers in the United States.,Filers will have until May 17 the agency said Wednesday. The extra time is intended to ease the burden on Americans dealing with the economic upheaval caused by the pandemic.,The retail giant joined an international push to provide standardized digital vaccination credentials.,The Federal Reserve’s economic estimates show rates at near zero for years along with faster growth and higher inflation.,Newly revealed memos show that government investigators saw red flags in Google’s behavior nearly a decade ago.,You can look up the status of your stimulus check on the I.R.S. website.,Although gasoline consumption may have peaked a report predicted that oil demand would probably increase in the coming five years.,Federal efforts to prop up carriers saved jobs but taxpayers likely paid big price.,Key bond yields jumped on Wednesday rising ahead of the Federal Reserve’s March rate decision and a news conference where Jerome H. Powell the central bank’s chair will discuss the economic outlook.,Witnesses testified on the impact of so-called payment-for-order-flow on retail trading.
2021-03-18,The Internal Revenue Service will automatically send refunds to early-filing taxpayers who qualify for the new break on unemployment income the agency’s commissioner said Thursday.,Government workers have been particularly hit hard by the pandemic. Nearly 1.4 million of the 9.5 million jobs that have disappeared over the past year came from state and local work forces.,A claim that the company illegally prohibits employees from discussing pay has been added to a lawsuit accusing it of paying women less than men. Disney has aggressively pushed back.,The change will eliminate around $1 billion in student loan debt owed by around 72000 borrowers the department said. Most of them attended ITT and Corinthian institutions that abruptly shut down years ago.,The hiring of Alexi McCammond who was supposed to start at the Condé Nast publication next week drew complaints because of racist and homophobic tweets she had posted a decade ago.,Officials said the social network had failed to block objectionable political content a sign of the sacrifices it must make to remain in the vast but difficult market.,New research from California illustrates both the scale and the inequality of the job losses during the pandemic — and makes clear that the crisis is far from over.,Charles Johnson a notorious conservative provocateur played a pivotal role at the start of the facial recognition company.,Super Nintendo World opened in Osaka Japan months after initially planned and with everyone clad in masks.,Penny stocks are back. Critics are worried.
2021-03-19,On platforms such as Telegram and 4chan racist memes and posts about Asian-Americans have created fear and dehumanization.,In the aftermath of a diesel scandal five years ago executives made a commitment to electric vehicles that now is paying off.,Education Dept. documents filed in federal court describe a process that denied 130000 claims from borrowers who say schools misled them.,Applicants are eligible for grants of up to $10 million from the Shuttered Venue Operators Grant fund which Congress created in the economic relief bill passed in December.,The central bank had exempted safe assets from a crucial regulatory requirement in a bid to keep markets chugging last year.,Therapy from afar. Books on the iPad. Friends via screens. Here’s the tech that’s sustained us.,More companies than ever are using software to screen their mountains of job applications. Getting seen by a human recruiter takes some effort.,The city of Taicang illustrates the tight ties between the countries — and how difficult it could be for President Biden to win allies in his campaign to isolate Beijing.,A group of analysts rated their job satisfaction as two out of 10 and said they were unlikely to stay at Goldman in six months if working conditions remained the same.,For eligible people H.S.A.s accept pretax contributions that grow tax-free and aren’t taxed if spent on qualifying expenses. But they’re underused experts say.
2021-03-20,Big ideas for rethinking pay.,0,0,0,0,0,0,0,0,0
2021-03-21,The author Ibram Kendi and The Boston Globe are teaming up to cover racism inspired by Boston’s 19th-century abolitionist newspapers.,To keep the virus out Beijing has enacted some of the world’s toughest border controls. Lives have been upended and business has been disrupted.,The deal is an effort by Canadian Pacific and Kansas City Southern to capitalize on an expected increase in the flow of trade as the three countries rebound from the pandemic.,But the giant oil company said it would pay $75 billion in dividends nearly all of it to the Saudi government.,Kedar Deshpande who took over as C.E.O. in August needs to lead the shoe seller out of the pandemic while maintaining what his predecessor built.,The government set out to prop up the economy. It may also be propping up the market.,0,0,0,0
2021-03-22,Multiple investors said they would donate any profits from their investments to organizations focused on survivors of sexual assault after its co-founder was accused of playing a role in a sexual assault scandal.,President Biden on Monday nominated Lina Khan to the Federal Trade Commission installing a vocal critic of Big Tech into a key oversight role of the industry.,If you still find NFTs hard to wrap your head around you’re not alone. Here’s what you need to know.,“The Ellen DeGeneres Show” a sturdy daytime hit has had a steep ratings decline since the host addressed accusations by former staff members that led to firings and an internal investigation.,Many musicians aren’t sharing in streaming riches. Can digital music economics change to benefit everyone?,Jerome H. Powell the chair of the Federal Reserve said the Fed’s research into central bank-issued digital currencies is early and exploratory — and that U.S. officials would only consider issuing a digital dollar if they believed there was a clear use and if the idea had widespread public and political buy-in.,It plans to remove restrictions only once the virus acts “more like an endemic virus such as the seasonal flu” an executive wrote.,The DealBook newsletter’s inbox has been overflowing with reactions to a presentation by employees at Goldman Sachs.,Turkey’s president Recep Tayyip Erdogan has repeatedly meddled in the central bank’s activities and over the years traders have dumped the lira.,Here’s a novel way to raise more revenue.
2021-03-23,The company’s stock was down roughly 12 percent in after-hours trading.,The bull market born out of the pandemic has turned a year old. The remarkable turnaround has some analysts wondering if the breakneck pace is sustainable.,Patrick Gelsinger Intel’s chief executive vowed on Tuesday that Intel would become a major manufacturer of chips for other companies in addition to producing the processors that it has long designed and sold.,The nation’s two most powerful economic policy officials testified together for the first time reviewing the state of the economic recovery.,The network’s list of hotel partners is vetted and evaluated every year and reads like a who’s who of aspirational travel. “As of March 8 2021 Trump Hotels are no longer part of the Virtuoso network” a spokeswoman said.,As streaming video has gained in importance during the pandemic advertisers have put more focus on Hollywood-level branded content as a way to reach viewers.,In a blow to cinemas “Black Widow” and “Cruella” will premiere on Disney+ at the same time as they arrive in theaters. Pixar’s “Luca” will now skip the big screen entirely.,The Texas city is a hot spot for commercial real estate investment and a magnet for corporations looking to move to a high-tech hub.,Married people who filed their returns jointly may receive their stimulus in two separate installments if their tax return includes something called an injured spouse claim.,Yes tech companies are hiring. Here’s why they want you to notice.
2021-03-24,Stewart W. Bainum Jr. a hotel magnate made an $18.50 per share offer for the whole company while Alden Global Capital had offered $17.25 per share.,The change which goes into effect the week of April 6 raises a cap that has frustrated many applicants.,Ms. Belton the editor in chief of Black news and culture site The Root and a self-described “hard-core nerd about media” said she would prioritize diversity.,Two avid readers from South Africa show what they find special about this talking and texting app.,Stat was one of the first outlets to extensively cover the coronavirus outbreak and saw a boost in traffic and revenue as its coverage gained attention.,The Swedish retailer is the latest fashion business to come under pressure from Chinese consumers after a perceived misstep.,Why can’t a journalist join the NFT party too?,Lawyers judges and lawmakers are advancing a bold idea: The powerful algorithms used by Facebook YouTube and Twitter could make them complicit in offline crimes.,“We will continue to provide the economy the support that it needs for as long as it takes” Jerome H. Powell the Fed chair said at a hearing before the Senate Banking Committee.,The highest bid for Mr. Cleese’s work is now about $36000. “I think it’s very funny” he said. “At the same time we might make some money.”
2021-03-25,The board required that Tesla reinstate the employee and that Mr. Musk delete the tweet. It also required that the company amend its confidentiality agreement.,The leaders of Google Facebook and Twitter faced sharp questions about misinformation’s role in the attack and the mental health of children who use their products.,A digital collectible based on a column in The New York Times sold at auction on Wednesday with proceeds going to the Neediest Cases Fund.,Greg Spottiswood had faced numerous complaints over the way issues of race and gender were addressed on the show a rare prime-time CBS drama with a Black woman as a protagonist.,Whether banks are able to restart normal payouts which help to boost their share prices and reward investors will hinge on whether they have capital above their required minimum levels.,Income-share agreements are gaining popularity but a new analysis highlights how calculations of what borrowers owe can penalize minorities.,Mr. Dorsey’s comments in response to a question from Representative Mike Doyle Democrat of Pennsylvania appeared to be the first public acknowledgment by a top social media executive of the influence of the major social media platforms on the riot.,The debate reflects our discomfort with the power of Big Tech and our desire to hold someone accountable.,The chief of the tabloid-style Bild newspaper “made mistakes” but does not deserve to lose his job an inquiry found. He will share power with a female colleague.,Lawrence H. Summers a former Treasury secretary is among those who have voiced concerns about inflation as Washington does more to boost the economy.
2021-03-26,Before this week’s meltdown ViacomCBS had actually been on a bit of a tear rising nearly tenfold in the past 12 months.,Bidders say they had many different motivations including fun self-promotion and a signal of support for the NFT market.,Tens of millions of people who receive benefits from Social Security or other programs but don’t have to file a tax return are closer to receiving payments.,Volkswagen had been reluctant to publicly accuse former top managers of complicity in the emissions fraud which has cost Volkswagen tens of billions of euros in fines settlements and legal fees.,Union members said they were prepared to walk off the job as contract negotiations with Condé Nast break down.,People are buying digital items like a tweet and a meme for bonkers amounts of money. Let’s take a step back.,The most common option for ships trying to avoid the logjam is to reroute themselves around Africa’s Cape of Good Hope.,Alex Rodriguez isn’t like the other athletes getting into blank-check firms.,Dominion Voting Systems an election technology company accused the channel of advancing lies that devastated its reputation and business.,The money-losing office space firm plans to merge with a blank-check company backed by big Wall Street investors.
2021-03-27,The philanthropist Hansjörg Wyss has teamed with the Maryland hotel executive Stewart Bainum in a bid to upend Alden Global Capital’s plan to acquire the newspaper chain.,Junior bankers are burning out. What should banks do about it?,Google presents itself to independent sellers as cheaper and less restrictive. But it is not clear whether it can change people’s habits of going straight to Amazon.,0,0,0,0,0,0,0
