2021-10-06,People InStyle Entertainment Weekly and more than 40 other magazines would become part of the same company as Serious Eats and Investopedia.,Jurors’ eyes glazed over at detailed technical discussions as Theranos’s former lab director described repeated instances of irregular and inaccurate results.,The company’s chairman a fellow co-founder and an early investor are all listed as multibillionaires.,Shortly after the C.E.O.s met with President Biden Senator Mitch McConnell said he would allow Democrats to raise the debt ceiling enough to push a potential default to December.,Under new ownership the online publication aimed at younger readers unveiled a revamped version of itself on Wednesday.,Included in the breach was a list that purportedly showed how much money each of the platform’s streamers had earned in the past two years.,This is a pivotal moment in Facebook’s history. Here are suggestions for how to improve the company.,G.M. said it would develop ride-hailing services that use autonomous cars create insurance products and expand its defense contracting work.,What we learned from Facebook whistleblower Frances Haugen’s Congressional testimony,The Treasury secretary says the government will run out of money to spend if Congress doesn’t raise the debt ceiling. Here’s what that could mean for programs that help millions of Americans.
2021-10-07,A program gave money to 700000 self-employed people who improperly claimed to have as many as a million employees according to an inspector general’s report.,“We’ve heard directly from a growing number of our advertising and publisher partners who have expressed concerns about ads that run alongside or promote inaccurate claims about climate change” the company said.,This week the International Monetary Fund’s executive board spent hours questioning Ms. Georgieva about her actions.,A former hedge fund manager Mr. Barsky led the nonprofit news organization to two Pulitzer Prizes in seven years.,Used car prices normally a tiny contributor to overall inflation have become a key influence on the direction of measures like the Consumer Price Index.,With each Facebook crisis we become savvier about the influence of tech companies on our lives.,President Biden is urging employers to move ahead with work force requirements as OSHA sorts through companies’ questions about how the rules will work.,Lael Brainard a Federal Reserve governor said officials are building climate scenarios for bank stress tests.,Stocks started their move higher on Wednesday after Republicans offered a short-term compromise to avoid the U.S. defaulting on its debts.,The airline is expecting strong holiday travel especially around Thanksgiving.
2021-10-08,At the heart of the legal battle is the power Apple wields over its lucrative App Store.,The S.E.C.’s chair has said that the Archegos trading debacle revealed gaps in the regulatory requirements for investment firms and lightly-regulated family offices.,Complete access will add roughly $40 to the price of daily park entry.,All of Facebook’s main products — Instagram WhatsApp Messenger and the “big blue app” of Facebook — were inaccessible to at least some users around 3 p.m. Eastern time.,Fans are coming up with creative ideas to incorporate masks into their cosplay as in-person gatherings resume with restrictions.,While its C.E.O. Elon Musk and the state’s conservative lawmakers share libertarian sensibilities they differ greatly on climate change and renewable energy.,Dig deeper into the numbers we're watching in September's jobs report.,Larry Fink is giving some investors more say over voting their shares.,The $530 million fine is Beijing’s second major penalty this year against an internet company accused of monopolistic practices.,The gain of 194000 in September showed the continuing grip of the latest coronavirus wave though unemployment fell to 4.8 percent.
2021-10-09,Some poorer countries are paying more and waiting longer for the company’s vaccine than the wealthy — if they have access at all.,In “Play Nice But Win” Mr. Dell delves into the drama behind some of the biggest deals of the past decade.,If what faces Big Tech is anything like what happened to Big Tobacco the road ahead is likely to be a yearslong battle over proposed rules and regulations.,As the International Monetary Fund gets set for its annual meeting economists ask if it’s time to update its mandate as the world’s financial crisis responder.,0,0,0,0,0,0
2021-10-10,A writer for an alt-weekly called out a Boston Globe editor for his “fealty” to the idea of objectivity in a column that reads as if it were written yesterday.,“No Time to Die” has taken in more than $300 million worldwide. The overall box office remains fragile however and the future for films that aren’t part of big-budget franchises is unsure.,Employees are divided over Frances Haugen a former product manager who testified that the company was putting profit before safety.,More than a thousand flights were canceled on Sunday and 800 on Saturday. The airline blamed air traffic control and “disruptive weather” but no other carrier reported problems.,An enduring traffic jam at the Port of Savannah reveals why the chaos in global shipping is likely to persist.,DealBook gathered experts to debate the solutions to cryptocurrency’s climate problem.,For brands associated with the Bond franchise the connection is valuable enough to throw do-over parties for the latest film.,0,0,0
2021-10-11,Netflix said in a statement that the transgender employee Terra Field was not suspended because of the tweets critical of Mr. Chappelle’s show.,The big banks are expected to benefit from increased consumer spending when they report earnings this week. Where they go from here will depend greatly on lending to households and businesses.,Black business owners were more likely to get Paycheck Protection Program loans from online lenders than from banks according to new research.,His retirement adds to brain drain at the world’s largest entertainment company as a new generation of executives rise to power.,The announcement was a further retreat from the rigid stance the tech giant had taken earlier this year.,The airline and its pilots union denied that the cancellations were related to the company’s decision to require employees to be vaccinated against the coronavirus.,The Chinese real estate developer has three more payments due Monday on its dollar bonds and offshore bondholders are beginning to worry.,Joe Bae and Scott Nuttall are taking over as co-chief executives in a succession plan that was set in motion in 2017.,Southwest’s weekend disruptions fueled opposition to corporate vaccine mandates.,David Card Joshua Angrist and Guido Imbens were honored for delving into cause and effect in ways that shed light on labor markets.
2021-10-12,The International Monetary Fund says the persistence of the coronavirus and global supply chain crisis weighs on economies.,A government report shows how the balance of power in the labor market has swung toward workers.,“This does not change anything for American” a spokeswoman said. When the airline introduced its mandate it cited a presidential order that employees of government contractors be vaccinated.,A survey by the Federal Reserve Bank of New York shows inflation expectations are the highest since 2013 adding pressure for Fed officials.,When the tech giants splurge on big-ticket investments it’s great for them but hard for others to keep up.,Recent commercial real estate transactions in New York.,General Motors has recalled 141000 Bolts to replace battery packs that can catch on fire because of manufacturing defects.,A plan outlined by President Emmanuel Macron commits 30 billion euros to finance crucial industries and cut greenhouse emissions.,Companies start reporting their third-quarter earnings this week and profits are expected to have risen substantially. But worries of future growth are growing.,The global growth forecast was pared to 5.9 percent from 6 percent because of the Delta variant and supply chain bottlenecks. The U.S. growth prediction was cut to 6 percent from 7 percent.
2021-10-13,In his most direct comments to date on the contentious Russian pipeline President Vladimir V. Putin called it an “obvious” way to relieve Europe’s soaring natural gas prices.,The social network which has been under increased scrutiny after a former product manager turned into a whistle-blower is trying to prevent leaks.,Federal Reserve officials are preparing to slow bond buying and are divided over when they might need to raise interest rates as inflation bites.,Starting next week the American private equity firm will take a more forceful approach to vaccines than many other firms in Britain.,Why are DoorDash and Instacart letting businesses buy their way to the top of search results?,In a letter the National Highway Traffic Safety Administration reminded Tesla that federal law requires automakers to initiate recalls if they find defects that pose a safety risk.,The increase a cost-of-living adjustment that applies to about 70 million Americans comes as consumer prices have jumped sharply.,Companies are juggling conflicting federal and state orders on coronavirus vaccine mandates.,Mr. Goldner who went on medical leave two days earlier has been credited with merging toys and entertainment.,Consumer Price Index data from the Labor Department showed that prices kept climbing in September as supply chain snarls and rising rents fueled rapid inflation.
2021-10-14,The comedian Dave Chappelle’s comments on transgender people and gender in “The Closer” have led to outside criticism and internal unrest at the company that upended Hollywood.,Federal prosecutors say Mark Forkner deceived the F.A.A. and was “scheming to defraud” customers.,The prevalence of videos claiming fraud dropped sharply according to New York University’s Center for Social Media and Politics.,Delivery workers started watch groups during the summer after bike thefts rose. Our reporter visited with one of these groups.,Natural gas prices have skyrocketed pressuring manufacturers and households with high energy bills.,Audiobooks are an example of a technology developed by or for people with disabilities that has helped all of us.,The hotel magnate Stewart Bainum has put together $15 million in annual funding for a nonprofit news site The Baltimore Banner.,The drugstore chain’s parent company said that it delivered 13.5 million vaccinations in the three months that ended in September.,The Microsoft-owned service had censored posts in China in compliance with the country’s laws to operate there.,The benchmark U.S. index rose 1.7 percent following a broad-based surge in share prices of materials tech and health care companies.
2021-10-15,Fees from advising corporate clients on mergers and other deals raised bottom lines across Wall Street. Bankers say it’s a good sign for the recovery.,Testimony addressed the question of whether Theranos was misleading and deceiving big corporations to get money.,Janneke Parrish who was a program manager for Apple Maps in Austin Texas was one of the two leaders of a group that called itself AppleToo.,In a town-hall-style meeting on Friday Ted Sarandos a co-chief executive of Netflix faced criticism from staff over Mr. Chappelle’s “The Closer.”,The Wall Street giant joined the country’s other big banks in beating analysts’ earnings expectations.,The 0.7% increase was better than expected. Rising consumer prices were a factor but economists said the results showed Americans wanted to get out and shop.,A big reason for the gains is investments with private equity firms which in some years have received more in fees than endowments have paid out in tuition help.,Big college endowments had a bumper year.,The automaker had initially planned to produce a million vehicles in November but now projects it will make 850000 to 900000.,Some analysts say they cannot determine if plant-based foods are more sustainable than meat because the companies are not transparent about their emissions.
2021-10-16,DealBook spoke with the Harvard researcher and biotech founder David Sinclair about the opportunities and challenges of hacking the human lifespan.,A new project aims to incorporate the cost of lawsuit settlements and inequality when rating municipal bonds.,The app hailed as Facebook’s growth engine has privately wrestled with retaining and engaging teenagers according to internal documents.,0,0,0,0,0,0,0
2021-10-17,A high-flying German media giant is ahead on digital media but seems stuck in the past when it comes to the workplace and deal-making.,The company which went public earlier this year has lessons for other internet outfits aiming to attract younger users even as its own audience gets older.,The tentative agreement came hours before a strike deadline and avoids a production shutdown at TV and movie studios already scrambling to make up for time lost in the pandemic.,0,0,0,0,0,0,0
2021-10-18,A long-anticipated report did not suggest any policy changes in response to the meme stock frenzy that caused some little-regarded shares to soar.,Under her leadership the Academy has taken steps to diversify and expand its membership.,The tech giant rolled back some of the changes it had made to its laptops getting rid of the unpopular Touch Bar and re-adding ports for an HDMI cable and an SD memory card.,The American Rescue Plan could be pushing inflation up slightly and temporarily a Federal Reserve Bank of San Francisco analysis said.,The editor Julian Reichelt had been accused of abusing his power involving a relationship with a junior employee at Bild a tabloid owned by the media giant Axel Springer.,Mr. Gates who at the time was Microsoft’s chairman had asked a female employee out on a date a Microsoft spokesman said.,A bipartisan group told the company that they were considering referring their concerns to the Justice Department for a potential criminal inquiry.,A push in the Buffalo area could produce the first union at company-owned stores in the U.S. But backers say moves by management are having a chilling effect.,Supply chain issues have made all kinds of products — paint and lumber certain foods clothing and electronics — harder to find.,An exchange-traded fund tied to the cryptocurrency is set to begin trading on the New York Stock Exchange a milestone for the industry.
2021-10-19,The agency said Arizona South Carolina and Utah had failed to adopt rules protecting workers from the coronavirus.,Large companies including G.E. have cited a requirement which President Biden announced in September that federal contractors be vaccinated when introducing mandates.,With government officials around the world slowly easing travel restrictions and companies starting to send employees on more business trips United’s executives expressed optimism about the coming months.,Investigators said more than $200 million was used to pay bribes and kickbacks to enrich foreign officials and former bankers at Credit Suisse.,The company has 222 million customers with 67 million in the U.S. and expects to add 8.5 million subscribers in the December quarter.,Since 2011 more than 500000 of the 1.2 million people who received prepaid cards from JPay were forced to pay fees to retrieve their money the Consumer Financial Protection Bureau said.,The virtual walkout planned for Wednesday is the latest example of how the internal backlash over the comedian’s new special has roiled the streaming service.,Start-up implosions don’t matter to most people. But the feelings of unfairness affect us all.,The Justice Department sued the company in December arguing that Facebook had declined to “recruit consider or hire” qualified United States workers for more than 2000 positions.,Autumn was meant to mark the beginning of the end of the labor shortage that has held back the nation’s economic recovery. Expanded unemployment benefits were ending. Schools were reopening freeing up many caregivers. Surely economists and business owners reasoned a flood of workers would follow.
2021-10-20,The protest involved dozens of employees and was one of the most visible signs of worker unrest in the history of the streaming service.,The automaker also reported a big jump in revenue to $13.8 billion from $8.8 billion a year ago as sales of the Model Y continue to rise.,Multinational conglomerates like Danone Nestlé and Procter & Gamble blamed supply chain disruptions for the jump.,Buying a $1000 iPhone can be equivalent to giving up $17000 in retirement savings or 2500 cups of coffee.,If completed it would be the largest consumer internet deal of the past decade.,Over-the-counter hearing aids have the potential to show government and tech companies at their best.,The drug Aduhelm brought in $300000 in revenue in its first full three months of availability. The company expects the drug to generate minimal revenue for the rest of the year.,DuPont factories pumped dangerous substances into the environment. The company and its offspring have gone to great lengths to dodge responsibility.,A new high for the S&P 500 would cap a volatile stretch of trading that saw the benchmark fall nearly 5 percent in September.,The developer once China’s most prolific has more than $300 billion in unpaid bills and is facing a crisis that has sent a wave of panic through global markets.
2021-10-21,A merger with a so-called blank check company is poised to give the former president access to hundreds of millions of dollars.,Snap the parent company of Snapchat said that it had expected some disruption but that challenges for advertisers had been more severe than expected.,After weeks of fluctuations driven in part by Washington gridlock share prices hit another high and put a dismal September in the rearview mirror.,The Federal Reserve faced scrutiny after two regional bank presidents disclosed questionable 2020 trading. Now it’s revamping the rules.,The move is a concession to regulators and lawmakers who are challenging whether the company has overcharged developers.,The agreement comes as more than 130 countries agreed this month to an overhaul of the international tax system that will see nations adopt a global minimum tax of 15 percent.,It all comes down to having power over what Americans watch and how.,Both airlines said they expected to do even better in the final three months of the year lifted by corporate international and holiday travel.,The social network’s oversight board took aim at an internal program that gives prominent users special leeway on rules.,We’re interested in learning as much as possible about how employers manage their work forces.
2021-10-22,Prosecutors focused on her alleged deceptions trying to make the case that she intentionally misled Theranos’s investors and commercial partners.,Safety protocols for firearms on set are well established and straight forward and injuries of any kind are rare.,Company documents show that the social network’s employees repeatedly raised red flags about the spread of misinformation and conspiracies before and after the contested November vote.,The announcement came one year after Goldman admitted criminal wrongdoing by its Malaysian subsidiary for its role in the looting of 1MDB the Malaysian government’s sovereign wealth fund.,Social media platforms like TikTok and Instagram try to monitor for content related to the problem but it is not always clear what to do about it.,The new details came in an unredacted version of a lawsuit filed by Texas and 11 other states.,The deficit was not as high as projected as the strengthening economy bolstered tax revenue.,Jerome H. Powell said that it was important for policy to be positioned to react and that the Federal Reserve would act to keep prices stable if necessary.,Confession: We didn’t even have a logistics beat before the pandemic. Now we do. Here’s what we’ve learned about the global supply chain disruption.,The investor Boaz Weinstein moved to abandon a blank-check fund that announced a deal with the former president.
2021-10-23,Internal documents show a struggle with misinformation hate speech and celebrations of violence in the country the company’s biggest market.,Since July the N.C.A.A. has allowed athletes to make money from endorsement deals. Fans don’t seem to mind.,0,0,0,0,0,0,0,0
2021-10-24,A knot of problems with Amazon’s system for handling paid and unpaid leaves has led to devastating consequences for workers.,A team of private security sleuths in their first public detailing of their efforts discuss how they used cybercriminals’ mistakes to quietly help victims recover their data.,0,0,0,0,0,0,0,0
2021-10-25,Mr. Chappelle’s special has put Netflix at the center of a conversation involving transphobia free speech and employee activism.,The results in the latest quarter are a sign of the company’s financial strength as it faces a public relations crisis.,The outcome could bring a second unionization vote at an Amazon warehouse in less than a year.,Fewer foreign people have been able to work in the U.S. amid the coronavirus leaving a hole in the potential labor force.,With long battery life and nice cameras the new Google devices excel at what popular phones have done for years. Is that enough?,The deal to join the stock market through a merger with a shell company would value the e-sports conglomerate at about $1 billion.,The order to be fulfilled between now and the end of next year is a sign of the growing momentum in the shift toward electric cars.,Leaders are weighing a new charge on unrealized capital gains for the ultrawealthy.,A look at a month of scrutiny and struggles for the social-networking giant.,Likes and shares made the social media site what it is. Now company documents show it’s struggling to deal with their effects.
2021-10-26,The streaming service said it would bid for a nearly 300-acre chunk of Fort Monmouth and it has the support of Gov. Phil Murphy.,The earnings were driven by success in the company’s Microsoft Cloud business which includes Office 365 subscriptions and Azure.,The results easily topped analysts’ forecasts.,The social media company said the effects of Apple’s privacy changes had not been as severe for its advertising business as for other companies.,The government wants to bolster electricity supply and ease dependence on foreign developers like China.,The social media giant is making bonkers money. But it aims to turn itself inside out to get more young people.,Inflation is as much a psychological process as an economic one. And a key indicator of inflation expectations has risen in recent days which could ultimately lead to higher interest rates.,New technology and stricter standards allow them to better track a development’s carbon footprint.,Recent commercial real estate transactions in New York.,Lawmakers pressed the executives on the mounting concerns that their services harm children and teenagers.
2021-10-27,A major investor testifies.,Revenue fell 5 percent from a year earlier but the automaker said chip availability had “markedly improved” since the previous quarter.,Americans are paying more for food and beverages as large corporations are able to pass on higher costs brought on by supply chain delays and labor shortages.,The move follows intense scrutiny after a whistle-blower provided documents about the social network’s inner workings.,Candid looks at the inner workings of influential tech companies shouldn’t be so rare.,The cost of food is soaring — and it’s changing shopping and eating habits for tens of millions of Americans.,“A new age of optimism” is coming said Chancellor Rishi Sunak while inflation and shortages still bedevil the country.,The aircraft maker reported $15.3 billion in revenue in the third quarter up about 8 percent from the same period last year and just below analyst expectations.,The automakers said the profit outlook for the full year had improved and higher car prices eased the impact of reduced production.,The world is facing an energy credit crunch in part because of Wall Street’s E.S.G. focus warned Steve Schwarzman of Blackstone.
2021-10-28,The team behind “Rust” chose not to get an insurance package often carried by productions which some in Hollywood said was a sign of cutting corners.,Thousands of local and state police departments are customers for Clearview’s facial recognition tool the company says.,The bank will consider requests for medical and religious exemptions.,The company’s profit was lower largely because of higher labor costs and huge investments in its delivery network.,Evergrande has warned in securities filings that it could not guarantee it would meet its financial obligations because of challenges it has faced selling assets.,They are tech titans entertainment moguls and heirs to great fortunes. Their ranks grew during the pandemic changing the political conversation around taxing the wealthy.,The social network under fire for spreading misinformation and other issues said the change was part of its bet on a next digital frontier called the metaverse.,“I’m probably going to get in trouble for this” Mr. Rivera said after taking issue with “false flag” claims in Mr. Carlson’s upcoming three-part series “Patriot Purge.”,The video game publisher said it would spend $250 million on hiring more women and those from “underrepresented communities” and adopt a zero-tolerance harassment policy.,Novara a London news group fell victim to YouTube’s opaque and sometimes arbitrary enforcement of its rules.
