Date,News 1,News 2,News 3,News 4,News 5,News 6,News 7,News 8,News 9,News 10
2020-01-01,A Brooklyn wine bar and restaurant is one of a handful of establishments in different cities that are trying to eliminate waste from their premises.,The country’s central bank will in effect inject $115 billion into the financial system despite signs the economy has been improving.,From smart homes to ultrafast wireless speeds here’s what to watch.,Sales doubled in 2019 but the industry’s tipping point — severing ties to the gas pump — still lies ahead. These cars will help make that happen.,0,0,0,0,0,0
2020-01-02,The fallen auto titan held early discussions with a movie producer before his audacious escape. The film’s villain: Japanese justice.,Ten months after he chafed under AT&T’s takeover of the network he reboots himself as a producer in a five-year deal with Apple TV Plus.,Oyo aims to be the world’s biggest hotel chain. But its growth was fueled by questionable practices employees said.,Emerging details suggest that the former Nissan and Renault chairman owes his arrival in Lebanon to an escape plan on a grand scale.,The owner of Steve McQueen’s “hero car” figures the price could approach $5 million or at least far more than the $3500 his father paid in 1974.,Mr. Ghosn the former Nissan and Renault chief fled Japan to avoid trial and arrived in Lebanon this week.,0,0,0,0
2020-01-03,The fugitive from Japan has put Lebanon in an awkward position.,The lawsuit claims the company targeted minority women and children despite being aware of the risk of asbestos in talc.,The best stories that you might have missed.,The electric-car maker ended a volatile year with a 50 percent jump in deliveries sending its shares to a new high.,Markets were shaken by the death of a major Iranian general at the orders of President Trump a killing that escalated tensions between Washington and Tehran.,As violence escalates and the Chinese government exerts greater control over the financial hub residents wrestle with their options.,More details about the former auto executive’s escape emerged. The Japanese news media said cameras showed him leaving his Tokyo home alone.,Analysts warned that the airstrike on an Iranian commander raised the prospect of volatility in Iran and Iraq two major oil producers.,0,0
2020-01-04,Americans are also continuing to buy ever bigger cars at prices escalating faster than the overall inflation rate.,0,0,0,0,0,0,0,0,0
2020-01-05,The civil rights group is trying to stop state and local branches from accepting money from utilities that promote fossil fuels and then lobbying on their behalf.,Companies spent $99 billion on mobile ads last year even as some made commercials that acknowledge the downside of smartphones.,The company and regulators are looking into everything from the wiring on the plane to its engines.,Officials breaking their silence said they would tighten immigration procedures and investigate how the fallen auto executive was able to elude tight surveillance.,Federal Reserve rates are still really low. Mr. Bernanke believes unconventional policies can make up for that — but with a caveat.,0,0,0,0,0
2020-01-06,The furniture chain is the latest retailer to struggle with declining store visits and changing consumer tastes.,His shelves are mostly empty but Mitoshi Matsumoto plans to continue his fight against the company to change Japan’s tough convenience store culture.,The federal government has been in charge of a chain of Illinois nursing homes that defaulted on mortgages backed by a government program.,The self-governing island is on high alert for digital-age trickery and deception that Beijing might be using to try to swing a crucial election.,The video service is making several changes after a settlement with federal and state regulators.,Oil prices climbed again while stock markets slipped as the fallout from the U.S. killing of a top Iranian general continues.,The former auto magnate boarded a bullet train for the first leg of his escape to Lebanon which officials in Tokyo are still investigating.,Harsh rhetoric between Tehran and Washington spooked investors at first but the S&P 500 regained its footing during the day.,0,0
2020-01-07,A private equity firm wants to buy the internet domain used by nonprofits. A group of online pioneers says it is not the place to maximize profits.,The request could reignite a fight between the Silicon Valley giant and law enforcement over access to encrypted technology.,Cracks in the conservative commentariat as the White House struggles to form a clear narrative.,Mr. Bosworth a Facebook executive weighed in on the platform’s role in political polarization.,In an internal memo Andrew Bosworth said he “desperately” wanted the president to lose. But he said the company should avoid hurting Mr. Trump’s campaign.,The muted initial reaction to last week’s killing of an Iranian general points to confidence that shipping lanes will be unaffected.,A model presented by Hyundai and Uber at the Consumer Electronics Show is said to hold the promise of aerial ride sharing at 180 miles an hour.,The company had long maintained that the training wasn’t needed to fly the plane which was grounded after two deadly crashes.,The maker of home speakers said Google and Amazon stole its technology and abused their power but it could only risk suing one.,Aging stadiums are usually demolished but dormant Meadowlands Arena in New Jersey has become a soundstage for a prime-time series.
2020-01-08,The online magazine deleted a glowing story about Facebook after questions were raised about whether it was an ad.,After years of hype carriers like AT&T and Verizon are giving consumers clarity on what their next-generation cellular networks will realistically do.,The crash in Tehran of a 737-800 which killed all 176 onboard and Iranian strikes against military bases in Iraq moved markets. What’s next?,The vulnerabilities which the app says it has fixed could have let attackers manipulate content and extract personal data.,Stocks rallied and oil fell after it became clear that Iran and the United States were backing away from further confrontation.,In Beirut the fugitive ex-Nissan chairman made his first public comments since he fled Japan at news conference and in an interview with The New York Times.,0,0,0,0
2020-01-09,The former Fox News anchor has mostly ignored the movie in which she is played by Charlize Theron — until now.,Travelex’s stores airport counters and exchange services were forced offline by a ransomware attack on New Year’s Eve.,Responding to criticism that it was cutting into restaurant profits the food-delivery giant said it was making a change to stop charging fees for calls that do not end with an order.,The travel ban was issued as Lebanon begins to consider how to treat the former executive facing financial charges in Japan.,The number of original series continued to swell in 2019 with Apple and Disney adding to the glut. When will the bubble pop?,The S&P 500 added to a nearly 30 percent rally in 2019 thanks to a combination of low interest rates and receding economic risks.,The tech giant said it would not impose limits on such advertising despite pressure from liberal and conservative critics.,Vehicles from Japan and Britain strike a chord with collectors looking for a different kind of wow factor.,The company was under intense pressure to adjust its policies. But in this presidential election year no big changes are planned.,The Lehigh Valley rebuilt its economy after foreign competition wiped out its mills. Now good times and bad memories may both help the president.
2020-01-10,A trove of internal employee communications shows that the aviation giant’s troubles go beyond one poorly designed plane.,Dennis A. Muilenburg who was ousted last month forfeited stock awards worth some $14.6 million but he is still contractually entitled to receive other benefits.,By opting not to change the company’s political advertising rules Mark Zuckerberg has ensured another election shaped by the social network.,The agreement with Vision Property Management would require the company to provide clean titles to 58 renters in the state.,The university investigated its history with Mr. Epstein after Joichi Ito the face of its prominent Media Lab program acknowledged receiving money from the convicted sex offender.,David Drummond who played a key role for the company since it was founded was being investigated for relationships with several women at the company.,Spirit AeroSystems which supplies the fuselage for the 737 Max said the layoffs were due to uncertainty around when production will resume.,If the tech industry was hoping for some relief from lawmakers’ pressure the start of the year had to have been a disappointment.,Samira Ahmed sued the British public broadcaster for back pay after she learned that a male colleague doing similar work was paid more than six times as much.,Boeing released more than 100 pages of internal messages about the 737 Max to Congress. It didn’t make for comfortable reading.
2020-01-11,She attributed her move to creative differences. “In my opinion” she said “there is more work to be done on the film to illuminate the full scope” of the women’s allegations of sexual abuse.,The former Nissan executive remains in Tokyo awaiting a trial on criminal charges that he helped Mr. Ghosn hide his compensation.,Three times now Arjav Rawal has tweeted the results before their official release beating even CNN a poll sponsor.,A presidency in crisis a nation on the brink of war — and a White House press secretary who was largely out of sight.,0,0,0,0,0,0
2020-01-12,The rule could limit the exposure of companies like McDonald’s to wage claims and other complaints. It effectively replaces a more labor-friendly Obama-era approach.,Lawmakers from both parties blame companies like Facebook and Google for the struggles of local newspapers.,Steve McQueen’s hero car from a renowned Hollywood chase scene breaks expectations in a sale for $3.74 million.,The cab business is down 75 percent in less than a decade. The plan is to make taxis a lot more like their app-hailed rivals.,0,0,0,0,0,0
2020-01-13,The Indian hospitality start-up is losing hotel rooms and has stepped back from more than 200 cities as part of a broader pullback by firms financed by SoftBank.,Fearful of public anger over a plunging economy Iran’s leaders appear to be turning inward pulling back from escalation.,India opened a formal investigation into Jeff Bezos’ Amazon and its leading rival Flipkart just before his first visit in five years.,More companies are setting up shop in the country and more Indians who live elsewhere are returning to visit. Plus tourism is growing.,Some people think Phil Hogan’s blunt style will be an advantage in dealing with the Trump White House. He is making his first official trip to Washington this week.,The country’s vulnerable environment and growing dependence on China have raised questions about the sustainability of its economic success.,Michael McCain of Maple Leaf Foods blamed ill-conceived plans for diversions and “a narcissist in Washington” for the deaths of Canadians including a colleague’s family.,Steph Korey stepped aside as chief of the hip luggage maker last month after internet backlash over her management style. She’ll return as co-C.E.O.,Every four years the top political correspondent at The Des Moines Register has a big role to play. Now it’s Brianne Pfannenstiel’s turn.,Former employees of the luggage start-up told a tech website that Steph Korey had created a toxic culture. She stepped aside. But now she says that was a mistake.
2020-01-14,The Silicon Valley giant is preparing for a legal fight over encryption even as it works to reduce tensions with the Justice Department.,Business boomed for JPMorgan Chase and Citigroup last year. Even Wells Fargo which is struggling with operational problems managed to make shareholders happy.,Aventura Mall near Miami isn’t shy about investing in its infrastructure and is widely considered one of the most successful malls in the country.,Recent commercial real estate transactions in New York.,Goldman Sachs BMW and insider-trading legislation: It should be an interesting year in white-collar crime.,The $7 trillion investment giant says it will make environmental concerns a key investment focus and Wall Street may have no choice but to follow suit.,In his influential annual letter to chief executives Mr. Fink said his firm would avoid investments in companies that “present a high sustainability-related risk.”,Norwegian research raises questions about whether certain ways of sharing of information violate data privacy laws in Europe and the United States.,0,0
2020-01-15,Oil and gas companies may see an export revival from the accord but they seek commitments that tariffs will be dropped.,Ratings results from the debate in Iowa.,The agreement includes some wins for President Trump but implementing and enforcing the deal could be difficult.,Subscription services like Netflix and Google Drive are convenient but we can lose control of our content and data. Here’s how to take it back.,President Trump and a top Beijing official will meet today to sign an initial deal that eases the trade war. But many issues remain unresolved.,Companies have long accused Chinese rivals of swiping or seizing valuable technology. Beijing promises to ban those practices but enforcement could be tough.,Wildlife’s global family appeal when the environment is “the issue of the age” gives Netflix and its rivals a rich supply of new content.,A new California privacy law gives consumers the right to see and delete their data. But getting access often requires giving up more personal details.,0,0
2020-01-16,Under 5 percent of its advisers are black the bank said in response to questions from Democrats in Congress. The lawmakers want to know more.,The film starring Samuel L. Jackson and Anthony Mackie was withdrawn after a producer a son of one of its protagonists was accused of sexual misconduct.,As the retailer goes through liquidation employees at its flagship store say they haven’t received information about a closing date severance pay or benefits.,Hourly wage earners at Creative Artists Agency score a victory for the #PayUpHollywood movement.,Borrowers whose schools abruptly shut down or used misleading practices won’t have to pay taxes on their forgiven balances.,Consumers are spending and Beijing reached a trade deal with the U.S. but the Chinese economy still faces a difficult addiction to borrowing.,The internet search giant became the fourth tech company — after Apple Amazon and Microsoft — to reach the market milestone.,The S&P 500 Nasdaq and Russell 2000 are all in record territory.,Comcast a late convert to streaming is distinguishing itself from Netflix and other competitors by embracing ads.,The new deal between the United States and China leaves untouched the thorniest issues driving the two economic giants apart. Solving them could take years.
2020-01-17,Until Friday few executives had complained in public about how Google Apple Amazon and Facebook hurt their businesses.,Two new books examine how digital technologies are transforming businesses and the economy and look at the resulting ethical and regulatory concerns.,A growing number of academics are challenging assumptions about the negative effects of social media and smartphones on children.,The name change means consumers won’t mistakenly connect the Disney-owned studio with Mr. Murdoch’s polarizing Fox News.,If the future lets people focus on work instead of driving during the daily commute many of us will have to conquer motion sickness to read memos (or tweets). Researchers are working on some fixes.,After years of increases auto insurance has become a budget pain point for many. But experts say there are ways to keep your rates down.,There are tools to crack into the phones at the center of a new dispute over encryption. But the F.BI. says it still needs Apple’s aid.,The home-rental company plans to consider the needs of more than just investors in its corporate governance — and will factor them into employee pay too.,Some executives at small companies have reservations about President Trump but also concerns about Bernie Sanders and Elizabeth Warren.,The proposal could save costs and thousands of tons of electronic waste advocates say but previous measures have fizzled.
2020-01-18,A little-known start-up helps law enforcement match photos of unknown people to their online images — and “might lead to a dystopian future or something” a backer says.,0,0,0,0,0,0,0,0,0
2020-01-19,The Senate will control the cameras during the impeachment trial limiting what viewers see and reporters will be confined to roped-off areas.,0,0,0,0,0,0,0,0,0
2020-01-20,C.E.O.s have come to accept the president in spite of his populist views and governance-by-Twitter style. Tax cuts and a record stock market speak volumes.,The director general’s decision comes amid questions over a gender pay gap and political bias.,Like Trump India is pressuring both of Mr. Bezos’ businesses as its leaders become more nationalistic toward foreign companies and news media.,One-fourth of the documentaries in the Sundance Film Festival’s competition for American nonfiction films come from the same upstart company Concordia Studio.,A desire not to offend potential customers in a divided nation as well as wariness of President Trump’s Twitter account means fewer topical ads.,0,0,0,0,0
2020-01-21,The police raided offices in the latest diesel investigation of a major carmaker adding to the troubles of the Renault-Nissan-Mitsubishi alliance.,The streaming giant behind “The Crown” and “The Irishman” now has more than 167 million subscribers around the world.,The company told airlines it did not expect regulators to approve the plane to fly until June or July the latest in a string of setbacks.,SmileDirectClub which sells teeth aligners online has worked to limit information about customer dissatisfaction.,The détente emerged after Presidents Macron and Trump agreed to grant more time for talks over a global solution to taxing Amazon Facebook and other digital giants.,Local officials apologized but the crackdown on a common — and comfortable — practice has raised a rare outcry over privacy in a country accustomed to surveillance.,Recent commercial real estate transactions in New York.,Ford Motor is transforming the long-vacant Michigan Central Station part of the city’s overall resurgence.,Many of the elite who gather at the World Economic Forum were horrified by his election. But most seem to have come to accept the U.S. president.,The poor air quality is making equipment harder to operate and some workers have had to take leave to fight fires. The irony was not lost on many in Australia.
2020-01-22,It most likely began with a tiny bit of code that implanted malware which gave attackers access to Mr. Bezos’ photos and texts.,Bill Abbott’s departure was announced weeks after the network apologized for pulling a commercial that showed brides kissing.,In an extreme scenario the central bank might have lifted growth to around 3 percent at a hefty cost.,The chief executive could get a stock award worth hundreds of millions if the carmaker’s market capitalization is sustained in the months ahead.,France’s finance minister made the announcement a day after the two countries appeared to strike a temporary truce in a trans-Atlantic spat.,The day after Boeing said it did not expect regulators to approve the 737 Max to fly until the summer Mr. Trump brought up the company on at least three separate occasions.,Voice-activated helpers can automate life’s little chores once you get the hang of them.,A new report says the Amazon chief’s device was attacked using malware sent from a WhatsApp account tied to Prince Mohammed bin Salman Saudi Arabia’s de facto ruler.,Manufacturers and farmers struggled last year because of tariffs and there are signs that damage is spreading to other sectors of the economy.,The futuristic Origin which seats six passengers and lacks a steering wheel will require intensive testing and regulatory scrutiny before it can hit the streets.
2020-01-23,Just a year ago the world’s richest man seemed to have a pretty low-key life. Times sure have changed.,John Stumpf and two other former executives were fined Thursday and Wells Fargo’s chief federal regulator said it would seek penalties against five others.,In Davos business leaders were newly vocal about the danger though they gave few details about how they would reform their practices.,States’ voters approved $7.7 billion in transportation spending last year but the federal government needs to do more to fix the nation’s ragged roadways highway and engineering experts say.,As China closes off cities affected by the growing viral outbreak business leaders at the World Economic Forum fear a replay of the SARS epidemic.,Students in Cambridge Mass. and Ramallah have created an app to track road quality. It turns out the roads around Cambridge are worse.,The trade truce may have eased tensions between the world’s two largest economies but European and Latin American officials are worried it will come at a cost.,Like other central banks the E.C.B. which met on Thursday is scrambling to prepare for what a report warns could be a coming economic upheaval.,Online forums carry personal details of potential targets like industry leaders and their families. The police are struggling to find a solution.,Even before the California utility said it had an accord with bondholders Gov. Gavin Newsom declared that the plan didn’t meet the public interest.
2020-01-24,The tech giant has begun charging U.S. law enforcement for responses to search warrants and subpoenas.,Airline stocks exposed to the impact of travel restrictions related to China’s coronavirus outbreak were hard hit.,Schurman Fine Papers which also owns American Greetings and Carlton Card stores filed for bankruptcy on Thursday.,Top policymakers said easing trade tensions had raised prospects but low interest rates leave central banks few options if problems develop.,An analysis of a phone belonging to Jeff Bezos found malicious code was hidden in a video sent from a WhatsApp account belonging to Crown Prince Mohammed bin Salman.,For wealthy Davos men and women as well as people from less rarefied air targeted investing is one way to force change on carbon-emitting companies.,On England’s southwestern coast a community built by the Duchy of Cornwall is attracting residents who have bought into Prince Charles’s housing philosophy.,The city stepping into a debate over privacy says it will use real-time facial recognition technology “to tackle serious crime.”,The bank said that it would only work on an I.P.O. if the client had at least one “diverse” board candidate an attempt to increase women and minority directors.,A federal agency bans the sale of sheep lungs a key ingredient for Haggis. Lovers of the distinctive Scottish dish have found ways around that.
2020-01-25,FICO is tweaking its all-important formula. Scores will rise for about 40 million people and drop for another 40 million.,Reporting about the powerful tool with a database of three billion photos “troubled” the state’s attorney general who asked for an inquiry into its use.,0,0,0,0,0,0,0,0
2020-01-26,The White House granted TruNews a right-wing Christian site press credentials for the president’s Davos trip after its founder’s remarks calling impeachment a “Jew coup.”,As hedge funds take a greater role in newspaper chains journalists at the Chicago Tribune and elsewhere are sending out an S.O.S.,Once heralded as the next Nike the sportswear giant has been hurt by slumping sales and unflattering revelations about its corporate culture.,0,0,0,0,0,0,0
2020-01-27,The spread of the dangerous virus has spooked global markets and threatened prospects for economic growth.,The live broadcast drew an audience of 18.7 million but the dip was modest in a time when more people are switching to streaming.,TMZ drew a rebuke from a Los Angeles official after going first with the story of the former N.B.A. star’s death. Some other reports turned out to be false.,Travel providers now use software to re-price their offerings sometimes dozens of times a day putting travelers at a big disadvantage.,The president plans tariffs on metal items like nails and cables after his earlier move raised the cost of making those products in the United States.,A factory whose survival was a central issue in last year’s 40-day strike will get a $2.2 billion infusion for next-generation vehicles.,While social media praised the N.B.A. star after his death Felicia Sonmez posted a link to an article on the allegations of sexual assault made against him in 2003.,The sheer volume of criticism of the government and the sometimes clever ways that critics dodge censors are testing Beijing’s ability to control the narrative.,U.S. stocks followed European markets down amid concerns that the coronavirus could hurt the global economy.,The N.B.A. great was known for his feats on the court. But he had also been building a reputation as an investor and entrepreneur.
