2020-08-13,New state claims fell below one million for the first week since March. But jobless ranks remain vast and a White House relief plan faces hurdles.,Epic Games the maker of the popular game provoked the tech giants by violating their policies then released a social media campaign and lawsuits to confront them.,The agreement is a small fraction of the sum that Volkswagen paid after admitting to emissions cheating in 2015.,A Labor Department lawyer asserts that she faced reprisal after saying Secretary Eugene Scalia was set to settle a suit for a sum she found too low.,Followers of the pro-Trump conspiracy movement are winning elections and worrying moderate Republicans. Sound familiar?,QAnon can no longer be ignored. What internet companies could do to stop its spread.,Government efforts to subsidize wages and prevent layoffs have kept many in jobs but they aren’t sheltering an army of precarious workers.,It can be hard to keep up with everything going on in the markets. From DealBook here is a chart-heavy spin through some of the big stories you need to know.,A global “stalling of mobility” especially in air travel has prompted the International Energy Agency to make a slight downgrade in its forecast for oil demand in 2020. The agency said Thursday that demand would fall by 8.1 million barrels a day in 2020 140000 barrels lower than last month’s prediction.,A quick spin through the markets.
2020-08-14,More than 200 said they stood in solidarity with three former co-workers who have accused the company of discrimination.,App makers like the game company Epic and the music service Spotify are challenging Apple’s right to a large cut of their sales. Regulators have taken notice.,False and misleading information about Ms. Harris has surged in the days since she joined the Biden ticket.,The increase was a sign that consumerism remained resilient but the recovery has been buoyed by government assistance that expired at the end of July.,Many retailers are grappling with an unusual back-to-school shopping season which typically drives sales in July and August. This year is different with many schools and colleges planning to start remotely.,Many analysts had predicted that surging infections in states like Arizona California and Texas that forced restaurants and stores to close again after reopening once already would significantly dent retail sales in July.,A gutsy gambit by the maker of Fortnite which is locked in a fight with Apple and Google.,Three current and former employees expressed concerns about the Chinese-owned app’s safeguards for preteen children.,0,0
2020-08-15,The president who last week gave ByteDance 45 days to sell its stake or else face U.S. restrictions added a 90-day deadline under a national security law.,0,0,0,0,0,0,0,0,0
2020-08-16,Managers of the electric system argue that a lack of power prompted the decision to enact blackouts though demand this weekend fell short of the state’s peak years.,Millions of children have flocked to the online gaming site Roblox since March. That’s helping game developers some as young as 16 make a lot of money.,Nursing homes the center of the pandemic are seeking tax breaks federal cash infusions and protection against lawsuits.,0,0,0,0,0,0,0
2020-08-17,The agency that manages the state’s electric grid says rolling blackouts are needed to balance supply and demand. But the governor said regulators were not prepared.,Kevin Rudd a former prime minister lodged a complaint against The Australian for publishing material he called “racist and sexist.”,The Commerce Department placed new restrictions on the Chinese tech giant’s ability to work with the global chip industry.,The president’s restrictions on Chinese tech may be part of an eye-for-an-eye logic called reciprocity. The price could be a global patchwork of online fiefs.,Physicians say they regularly treat people more inclined to believe what they read on Facebook than what a medical professional tells them.,In the weeks since the U.S. Securities and Exchange Commission announced plans to effectively reduce institutional investors’ public disclosure of their holdings more than 1500 people have submitted comments to the commission. The overwhelming majority are opposed to the proposal.,As the Chinese-owned app negotiates its potential sale it is signing a different sort of deal.,The pandemic has created a bicycle boom — and a shortage. Giant the Taiwanese juggernaut is trying to meet demand while navigating the politics of trade.,Under pressure from governments and investors industry leaders like BP and Shell are accelerating their production of cleaner energy.,The quarterly slide an annualized drop of 27.8 percent coincides with a long and uncertain road to recovery.
2020-08-18,Nielsen ratings were down from 2016 though younger viewers watched online and MSNBC nearly doubled its usual audience.,The additional space and workers envisioned before the pandemic are a sign of how large tech companies continue to prosper.,Investors have cast the nearly relentless drumbeat of bad news aside to focus on any signs that the worst of the coronavirus pandemic might be over.,Explaining the “big tent conspiracy theory” that falsely claims that former President Trump is facing down a shadowy cabal of Democratic pedophiles.,A storied career that took him from teenage messenger to studio chief ends in a sudden resignation.,Recent commercial real estate transactions in New York.,A new suitor emerges for TikTok and the White House imposes more restrictions on Huawei. The net effect of such moves could be a fracturing of the web.,Airports have some of the most lucrative square footage in the world but the pandemic has crushed that calculus.,Under pressure to classify their freelance drivers as employees the ride-hailing companies are discussing another option.,After former employees described a toxic workplace the facade is cracking at her namesake talk show.
2020-08-19,Walmart and Target reported record sales in the second quarter driven by the convenience of one-stop shopping and their e-commerce operations.,The home rental company which was privately valued at $31 billion is trying to go public after its business was crushed by the pandemic.,After last month’s Facebook boycott companies are demanding more control over how their ads appear online. And the tech companies seem to be listening.,The social network also said it was restricting another 1950 groups 440 pages on Facebook and more than 10000 accounts on Instagram related to the conspiracy group.,Minutes from the Federal Reserve’s July meeting show that some officials fretted as expanded unemployment insurance ran out.,President Trump who has been pushing for a sale of the Chinese-owned video app did not say whether Oracle would be a better buyer than Microsoft.,Apple is the first U.S. company to hit that value a staggering ascent that began in the pandemic.,Got a new phone tablet or computer and want to repurpose or responsibly recycle the old one? Here’s a guide to moving on.,Gov. Kay Ivey of Alabama made a daring educational decision in June: She would fund a statewide student testing and technology program to help public universities and colleges reopen for in-person classes.,A new stock market high may seem strange when set against the human and economic devastation of the pandemic. Here’s how investors are justifying it.
2020-08-20,With the labor market showing new fragility most states have yet to seek funds under President Trump’s stopgap plan to supplement weekly jobless pay.,The pandemic which closed theaters around the world wreaked havoc on the premiere dates of movies like “Tenet” and “Wonder Woman 1984.”,Scores of power plants were down or operating below their capacity just as hot weather drove up demand.,It was the first known time that regulators directly interviewed a chief executive of one of the tech companies being scrutinized for potential antitrust violations.,The producer Mark Gill was already following a contrarian’s path before he decided to put “Unhinged” in nearly 2000 theaters during a pandemic.,Joe Sullivan who led Uber’s security team through the company’s most tumultuous period was fired by the company’s newly installed chief executive in 2017.,The 36-year-old producer Alana Mayo will lead the division which will release two or three films a year and focus exclusively on underrepresented filmmakers.,The companies under legal pressure to reclassify their California drivers as employees said they would halt rides before an appeals court gave them permission to continue.,Silicon Valley has enthusiastically backed Ms. Harris since she first ran for state attorney general in California a decade ago.,The iPhone maker is the first U.S. company to hit a $2 trillion valuation. How high can it go?
2020-08-21,As the longtime media executive moves to an adviser role American Media the parent of The National Enquirer has been renamed A360Media as part of a planned merger with a logistics company.,Live television viewership for the Democratic National Convention fell 17.6 percent from 2016 but many Americans watched online.,The nation’s major multiplex chains are selling tickets again and they have announced uniform health protocols to make patrons feel safer.,Forty-nine states Washington D.C. and two territories have so far signed on to President Trump’s stopgap program to get more money to the jobless. Here’s how it works.,The economy’s rebound showed signs of stagnating. Then enhanced unemployment benefits and a small-business loan program expired.,The Silicon Valley company could be the next in a string of tech outfits to go public long before they have turned a profit.,Mr. Wilke who has been a key lieutenant to Jeff Bezos is departing after building the e-commerce business for two decades.,The payment platform in partnership with Synchrony Bank offers a way to pay tuition at for-profit schools — at terms that are being called “predatory.”,The world’s biggest social network is working out what steps to take should President Trump use its platform to dispute the vote.,The editors and reporters for the DealBook newsletter sift through a lot of company reports and listen to many earnings conference calls. These are some of the things that caught our notice this week a big one for retailers explaining consumers’ shifting habits during the pandemic:
2020-08-22,The popular video app which is owned by a Chinese internet company said it had been deprived of due process when President Trump moved to block it in the United States.,With many vacationers reluctant to go abroad because of the pandemic “for the first time in the U.K. owning a caravan is kind of cool.”,0,0,0,0,0,0,0,0
2020-08-23,The social media service hid the president’s post about ballot drop boxes saying it violated Twitter’s election integrity rules.,Special purpose acquisition companies or SPACs are helping them and other fledgling companies raise money and gain coveted stock listings.,The territory’s attorney general wants to know more about Leon Black’s dealings with Jeffrey Epstein who died while facing sex-trafficking charges.,0,0,0,0,0,0,0
2020-08-24,The suit escalates a bitter back-and-forth between the popular video app and American officials.,The Chinese-owned video app plans to sue the Trump administration over its order to force a sale. It faces long odds.,Across England in numbers that travel businesses say they had rarely seen before lockdown-freed Britons are not only staying close to home this vacation season but spending it in motor homes campers campsites and glampsites. Vacationers are turning to camping as the holiday of choice for some social distancing in the great outdoors.,Concierge care which offers personalized medical services for people who can afford it has grown fast in the pandemic as patients seek direct access to physicians.,Despite furlough schemes that have kept tens of millions of people employed a tsunami of job cuts is about to hit as companies downsize.,As the pandemic accelerated the demise of some brick-and-mortar retailers a group of investors profited handsomely from their travails.,With a federal moratorium coming to an end legal aid lawyers say they are preparing to defend renters in housing court.,Dr. Tufekci a computer programmer who became a sociologist sounded an early alarm on the need for protective masks. It wasn’t the first time she was right about something big.,0,0
2020-08-25,American Airlines said it would furlough 19000 workers if lawmakers do not extend aid to the industry which has been hammered by the pandemic.,About 17 million tuned in on the Republican convention’s first night compared with 19.7 million for the Democrats. Close to half of TV viewers at 10 p.m. were watching Fox News.,In a discrimination complaint Bernadette Zilio says women were mistreated at the celebrity-news powerhouse led by Harvey Levin.,A group of journalists led by Maria Bustillos is building Brick House a network of publications with an unusual business model.,Britons eager for a bargain have taken up the government’s “eat out to help out” offer. But how long will the resurgence last?,Recent commercial real estate transactions in New York.,As Amazon signals its growth in India with its office in Hyderabad its largest in the world local business owners are pushing back.,SPACs are just getting started according to major players on Wall Street.,On Monday a judge in the U.S. District Court of Northern California heard arguments about whether to grant Epic Games the creator of the wildly popular video game Fortnite a restraining order against Apple. Epic sought the order last week after Apple cut off its support for an Epic software development tool Unreal Engine an action that Tim Sweeney chief executive of Epic called an “existential threat” to Epic’s $17 billion business.,Black homeowners say their homes are consistently appraised for less than those of their neighbors stymying their path toward building equity and further perpetuating income equality in the United States reports Debra Kamin:
2020-08-26,The 2020 version of the Federal Reserve’s loftiest annual meeting will be webcast this week allowing the public to tune in for the first time. It could be the stage for an important policy shift.,The expanded City First Bank which concentrates on underserved neighborhoods will be the nation’s largest Black-controlled federally insured commercial lender.,The World Economic Forum is pushing back its annual summit in Davos Switzerland from January to early next summer it announced on Wednesday.,We should minimize how much we share with all of our favorite and not-so-favorite apps. Here’s how.,A flurry of tech companies are filing to go public. Some of them — well one of them — even make a profit.,How did the talks between Microsoft and ByteDance the parent company of TikTok turn into a soap opera? Mike Isaac and Andrew Ross Sorkin spoke with more than a dozen people to understand what happened as the Trump administration began scrutinizing popular app:,President Trump’s plan to replace the $600-a-week emergency federal unemployment supplement originally called for unemployed workers to receive $400 each week with $100 to be supplied by the states. Here’s what we know now about the supplement.,A tech start-up named for objects in “The Lord of the Rings” has become a major government contractor. But what it does is not easy to understand.,The government could revive an idea to make it mandatory for large companies to report their pay gaps by ethnicity.,Neither side wanted a big deal. But what began as talks about a small investment ballooned with interventions from President Trump.
2020-08-27,Right-wing influencers are dominating the political discussion on Facebook raising questions about whether it will translate into electoral success in November.,New filings again exceeded one million last week and an extra $300 in jobless pay may not show up before mid-September in most states.,Dawn Davis who will become one of the few Black top editors in Condé Nast’s history will oversee a brand where many workers have complained of discrimination.,The ex-president of the United Auto Workers was charged with using union funds for personal expenses. The case is part of a long federal investigation.,The sale of the video app’s U.S. operations is entering its final stages with two groups having submitted bids.,Jerome H. Powell said the central bank would focus its efforts on fostering a strong labor market while tolerating higher inflation.,,Christy Miller says there are three things that shape her identity: making people laugh making people strong and lifting heavy objects. She can’t do any of those right now and she isn’t sure when she will be able to again.,Kris Fusco is finally back at work. That doesn’t mean her coronavirus worries are behind her.,Why have some states been able to move quickly to pay out the new $300-a-week unemployment benefit while others expect the process to take weeks? In a word: technology.
2020-08-28,Fox News dominated ratings for the Republican convention and MSNBC was the clear No. 1 for the Democrats’ gathering.,Big-budget films are being released for the first time since March but the willingness of people to sit inside a closed room with strangers for several hours is still uncertain.,Party in the park.,Investigators have charged big spenders with cheating the Paycheck Protection Program for small businesses. But more fraud lies below the surface and it’ll be harder to find.,Pandemic unemployment remains high federal aid is dwindling and additional relief isn’t imminent so keep an eye on your balance.,Microsoft with a new ally in Walmart and Oracle have submitted takeover bids for the video app. A deal could be reached soon.,The White House wants the Treasury Department to ensure that companies not workers will be held liable for paying the employee portion of the payroll tax when President Trump’s tax holiday ends.,The app’s Chinese version Douyin is trying to become a mobile marketplace where video stars promote products. That could be a model for the U.S. retail giant if it acquires TikTok.,The tech giant once an example of how not to operate in the nation’s capital now has a successful influence operation there.,0
2020-08-29,In an 11th-hour twist Beijing raised a potential hurdle for a sale of TikTok further roiling the race to buy the Chinese-owned app.,Despite challenges the N.B.A. continues to build its e-sports program saying it generates sponsorship revenue and provides valuable data on viewing habits of cord-cutters.,Professional basketball players demonstrated the enormous power of highly paid workers with rare skills but also their caution.,The Times’s attempt to bring the case to a close was denied and a federal judge set a Feb. 1 date to weigh Ms. Palin’s defamation lawsuit over an editorial.,0,0,0,0,0,0
2020-08-30,The coronavirus was an opportunity for the Treasury secretary to redefine his legacy for better or worse.,Current and former workers at Carta a hot Silicon Valley fintech company said they were belittled excluded and punished if they spoke up.,0,0,0,0,0,0,0,0
2020-08-31,Daniel Thompson an editor at The Kenosha News resigned over a headline that highlighted a speaker who made a threat during a peaceful protest.,China’s new export rules which could delay or scuttle a sale of TikTok have further turned giant companies into pawns in a geopolitical struggle.,Chinese companies account for a greater share of goods sold abroad showing their tremendous strength despite mounting challenges.,Not that long ago it was American oil powers — not tech giants — that ruled the economy and influenced world events.,The billionaire hedge fund manager is in talks to buy the New York Mets at a pivotal moment for the sports business — and his reputation.,Theater executives are betting that a Covid-19 vaccine will arrive and that studios will soon return to their decades-old system of releasing movies. “There is significant pent-up demand” for the theater experience one executive said.,When the pandemic hit the task of saving the economy was an opportunity for Treasury Secretary Steven Mnuchin to transform himself from an unremarkable Treasury secretary into a national hero.,The departing prime minister’s policies helped shake Japan out of decades of stagnation. But long-term restructuring efforts are needed to keep its economy charging forward.,He’s one of the most influential journalists of the last three decades but he’s shadowed by a 1994 magazine cover story that claimed to show a link between race and I.Q.,0
2020-09-01,The C.D.C. action cited the coronavirus risk if tenants are forced into shelters or other crowded quarters. It did not lift their rent obligation.,Lael Brainard a Federal Reserve governor said government support would be needed to support households and businesses as pandemic-induced pain continued.,Meditation apps tinctures stress-busting gummies — spending on commercials for all of them is rising amid the pandemic’s climbing death toll and economic strain.,The tech giants said states could soon send notices directly to smartphones asking people to opt in to the technology which helps trace the coronavirus.,The companies said the F.B.I. had warned them that the Kremlin-backed Internet Research Agency set up a network of fake user accounts and a website.,On Tuesday federal agents served a Massachusetts teenager with a search warrant. He appears to have played a significant role in the July 15 Twitter attack investigators and fellow hackers said.,The unfounded ideas have been circulating online for months.,The social media company is trying to clean up a feature that has been used for disinformation but stopped short of what critics want.,,As the outlook for retail hotel and office space shifts some developers are already planning to convert empty properties to new uses.
2020-09-02,A man who had written for a site that officials say was a front for a Russian group said his mysterious editor “had a different kind of agenda.”,Defying the pandemic the German carmaker began producing a new S-Class one of its biggest moneymakers. But can it catch up to Tesla?,September may seem early to be thinking about the holiday shopping season but retailers are already acknowledging that it will be transformed in fundamental ways.,Chris Wallace of Fox News Steve Scully of C-SPAN and Kristen Welker of NBC News will run the televised proceedings.,Six months after ceasing to be working members of the British royal family the Duke and Duchess of Sussex are Hollywood producers.,The country’s antimonopoly regulator has warned the powerful industry to improve the treatment of franchisees who have been fighting for shorter opening hours.,Republicans and Democrats agree that the U.S. economy could use more stimulus. They can’t agree on how to do it.,The battle against Covid-19 has ended an impressive growth streak but other challenges will make it hard for “The Lucky Country” to match its past success.,Several state governments may soon send residents an alert asking them to turn on “exposure notifications.”,Procter & Gamble says it can “turn the stressed life into your best life” in recent ads for StressBalls gumdrops whose ingredients include ashwagandha extract and valerian root extract. Nature’s Bounty a wellness company promises a way for its customers to “find peace” in new ads for Stress Comfort gummies which include ingredients such as gamma-aminobutyric acid melatonin and lavender extract.
2020-09-03,The S&P 500 dropped 3.5 percent on Thursday the biggest single-day fall since June 11 as big tech companies weighed on it heavily.,Progress in restoring lost jobs has become more challenging. “It’s pretty bad at this stage in the crisis” one economist said.,New research shows that minimum-wage violations spike as low-paid workers become more vulnerable and less inclined to complain.,Michael R. Bloomberg the former New York City mayor announced on Thursday that his philanthropic foundation would make a $100 million donation to four historically Black medical schools in an effort to improve the health and wealth of Black communities today’s DealBook newsletter reports.,Some businesses are hiring. Postings at the job search site Indeed rose slightly last week although the total is still more than 20 percent below what it was this time last year.,Karen Kent hopes this will be the last week she will have to file a jobless claim. A cafeteria worker at a high school in Pennington N.J. Ms. Kent 47 was laid off in early March when the pandemic hit and schools closed.,The billionaire’s gift is meant to ease students’ debts and free them to serve in needy communities.,The social network said it would block new political ads in late October among other measures to reduce misinformation and interference.,The billionaire is making a $100 million donation to four institutions in an effort to improve the health and wealth of Black communities.,Autos worth $500 or less have competed for 15 years in a circuslike race called 24 Hours of Lemons. Now electric vehicles have been invited with no limit on spending.
